{
  "$schema": "https://json-schema.org/draft/2020-12/schema",
  "$id": "visual-explainer/plan.schema.json",
  "title": "visual-explainer plan props",
  "description": "What a plan will build: goal, architecture, milestone and phase timeline, decisions with rejected options, risks.",
  "type": "object",
  "additionalProperties": false,
  "required": ["mode", "meta", "goal", "architecture", "milestones", "decisions", "risks"],
  "properties": {
    "mode": { "const": "plan" },
    "meta": { "$ref": "#/$defs/meta" },
    "goal": { "$ref": "#/$defs/text" },
    "tldr": {
      "description": "Optional TL;DR callout at the top of the report. Without it, the report uses the goal and the first 2 risks by impact.",
      "type": "object",
      "additionalProperties": false,
      "required": ["goal", "ask"],
      "properties": {
        "goal": { "$ref": "#/$defs/text" },
        "ask": { "$ref": "#/$defs/text", "description": "What the plan needs from the reader, for example an approval." },
        "risks": { "type": "array", "maxItems": 3, "items": { "$ref": "#/$defs/text" } }
      }
    },
    "doneWhen": {
      "description": "Optional Done when table of the report. Without it, the report uses the doneWhen of the phases of the first milestone.",
      "type": "array",
      "maxItems": 12,
      "items": {
        "type": "object",
        "additionalProperties": false,
        "required": ["criterion", "check"],
        "properties": {
          "criterion": { "$ref": "#/$defs/text" },
          "check": { "$ref": "#/$defs/text", "description": "How we check the criterion." }
        }
      }
    },
    "rabbitHoles": {
      "description": "Optional rabbit holes and no-gos: what the plan does not do. A leading \"No \" shows in bold.",
      "type": "array",
      "maxItems": 12,
      "items": { "$ref": "#/$defs/text" }
    },
    "media": { "$ref": "#/$defs/media" },
    "architecture": {
      "type": "object",
      "additionalProperties": false,
      "required": ["summary", "layers"],
      "properties": {
        "summary": { "$ref": "#/$defs/text" },
        "beforeTitle": { "$ref": "#/$defs/label", "description": "Optional label of the before panel: \"Before — <label>\"." },
        "afterTitle": { "$ref": "#/$defs/label", "description": "Optional label of the after panel: \"After — <label>\"." },
        "layers": {
          "description": "Layers from the top (user-facing) to the bottom (storage or platform).",
          "type": "array",
          "minItems": 1,
          "maxItems": 8,
          "items": {
            "type": "object",
            "additionalProperties": false,
            "required": ["name", "components"],
            "properties": {
              "name": { "$ref": "#/$defs/label" },
              "components": {
                "type": "array",
                "minItems": 1,
                "maxItems": 12,
                "items": {
                  "type": "object",
                  "additionalProperties": false,
                  "required": ["name", "role"],
                  "properties": {
                    "name": { "$ref": "#/$defs/label" },
                    "role": { "$ref": "#/$defs/text" },
                    "status": { "enum": ["new", "changed", "existing", "removed"] }
                  }
                }
              }
            }
          }
        },
        "flows": {
          "type": "array",
          "maxItems": 20,
          "items": {
            "type": "object",
            "additionalProperties": false,
            "required": ["from", "to", "label"],
            "properties": {
              "from": { "$ref": "#/$defs/label" },
              "to": { "$ref": "#/$defs/label" },
              "label": { "$ref": "#/$defs/text" },
              "status": { "enum": ["new", "changed", "existing", "removed"], "description": "Default existing. A new flow shows only after, a removed flow only before." }
            }
          }
        }
      }
    },
    "milestones": {
      "description": "Milestones in plan order. A plan without milestones is one milestone with number 1.",
      "type": "array",
      "minItems": 1,
      "maxItems": 12,
      "items": {
        "type": "object",
        "additionalProperties": false,
        "required": ["number", "title", "phases"],
        "properties": {
          "number": { "type": "integer", "minimum": 1 },
          "title": { "$ref": "#/$defs/text" },
          "outcome": { "$ref": "#/$defs/text" },
          "phases": {
            "type": "array",
            "minItems": 1,
            "maxItems": 80,
            "items": {
              "type": "object",
              "additionalProperties": false,
              "required": ["number", "title", "kind"],
              "properties": {
                "number": { "type": "integer", "minimum": 0 },
                "title": { "$ref": "#/$defs/text" },
                "summary": { "$ref": "#/$defs/label", "description": "One line for the phase list of the report." },
                "kind": { "enum": ["work", "pr-review"] },
                "gate": { "type": "boolean" },
                "lane": { "$ref": "#/$defs/label" },
                "repository": { "$ref": "#/$defs/label" },
                "dependsOn": { "type": "array", "maxItems": 20, "items": { "type": "integer", "minimum": 0 } },
                "estimate": { "$ref": "#/$defs/label" },
                "doneWhen": { "$ref": "#/$defs/text" },
                "components": { "$ref": "#/$defs/componentRefs", "description": "Relation: the components that the phase touches." }
              }
            }
          }
        }
      }
    },
    "decisions": {
      "type": "array",
      "minItems": 1,
      "maxItems": 30,
      "items": {
        "type": "object",
        "additionalProperties": false,
        "required": ["decision", "why", "rejected"],
        "properties": {
          "title": { "$ref": "#/$defs/label", "description": "Short label of the decision card." },
          "decision": { "$ref": "#/$defs/text" },
          "why": { "$ref": "#/$defs/text" },
          "rejected": {
            "type": "array",
            "minItems": 1,
            "maxItems": 6,
            "items": {
              "type": "object",
              "additionalProperties": false,
              "required": ["option", "reason"],
              "properties": {
                "option": { "$ref": "#/$defs/text" },
                "reason": { "$ref": "#/$defs/text" }
              }
            }
          },
          "phases": { "$ref": "#/$defs/phaseRefs", "description": "Relation: the phases that the decision affects." },
          "components": { "$ref": "#/$defs/componentRefs", "description": "Relation: the components that the decision affects." }
        }
      }
    },
    "risks": {
      "type": "array",
      "minItems": 1,
      "maxItems": 30,
      "items": {
        "type": "object",
        "additionalProperties": false,
        "required": ["risk", "impact", "mitigation"],
        "properties": {
          "risk": { "$ref": "#/$defs/text" },
          "impact": { "enum": ["high", "medium", "low"] },
          "likelihood": { "enum": ["high", "medium", "low"] },
          "mitigation": { "$ref": "#/$defs/text" },
          "mitigatedBy": { "$ref": "#/$defs/phaseRefs", "description": "Relation: the phases that mitigate the risk." },
          "components": { "$ref": "#/$defs/componentRefs", "description": "Relation: the components that the risk affects." }
        }
      }
    }
  },
  "$defs": {
    "label": { "type": "string", "minLength": 1, "maxLength": 120 },
    "text": { "type": "string", "minLength": 1, "maxLength": 4000 },
    "phaseRefs": {
      "description": "Relation: phase numbers. Each number must be the number of a phase in the milestones.",
      "type": "array",
      "maxItems": 40,
      "items": { "type": "integer", "minimum": 0 }
    },
    "componentRefs": {
      "description": "Relation: component names. Each name must be the exact name of one component in architecture.layers.",
      "type": "array",
      "maxItems": 20,
      "items": { "$ref": "#/$defs/label" }
    },
    "facts": {
      "description": "Optional label and value pairs under the report title. A value in backticks shows as code.",
      "type": "array",
      "maxItems": 6,
      "items": {
        "type": "object",
        "additionalProperties": false,
        "required": ["label", "value"],
        "properties": { "label": { "type": "string", "minLength": 1, "maxLength": 40 }, "value": { "$ref": "#/$defs/label" } }
      }
    },
    "media": {
      "description": "Optional screenshots. The report inlines each image. Figures without a change show in a Screenshots block after the architecture section.",
      "type": "array",
      "maxItems": 12,
      "items": {
        "type": "object",
        "additionalProperties": false,
        "required": ["path", "caption"],
        "properties": {
          "path": {
            "type": "string",
            "maxLength": 300,
            "pattern": "^[A-Za-z0-9_.-]+(?:/[A-Za-z0-9_.-]+)*\\.(?:png|jpg|jpeg|webp|gif)$",
            "description": "a relative path from the directory of the props file to a .png, .jpg, .jpeg, .webp or .gif file, with no \"..\" segment"
          },
          "caption": { "$ref": "#/$defs/text" },
          "section": { "$ref": "#/$defs/label", "description": "Reserved. Omit it." }
        }
      }
    },
    "url": {
      "type": "string",
      "pattern": "^https?://[^\\s\"'<>]+$",
      "description": "an absolute http or https URL"
    },
    "meta": {
      "type": "object",
      "additionalProperties": false,
      "required": ["title", "subtitle", "date"],
      "properties": {
        "title": {
          "type": "string",
          "pattern": "^\\S+(?: \\S+){1,3}$",
          "maxLength": 60,
          "description": "2 to 4 words separated by single spaces"
        },
        "subtitle": { "$ref": "#/$defs/text" },
        "date": { "type": "string", "pattern": "^\\d{4}-\\d{2}-\\d{2}$", "description": "YYYY-MM-DD" },
        "planId": { "$ref": "#/$defs/label" },
        "milestone": { "type": "integer", "minimum": 1 },
        "facts": { "$ref": "#/$defs/facts" },
        "links": {
          "type": "array",
          "maxItems": 10,
          "items": {
            "type": "object",
            "additionalProperties": false,
            "required": ["label", "url"],
            "properties": { "label": { "$ref": "#/$defs/label" }, "url": { "$ref": "#/$defs/url" } }
          }
        }
      }
    }
  }
}
